{
  "$schema": "../schemas/llama-runtime-catalog.schema.json",
  "schemaVersion": 1,
  "component": "llama.cpp",
  "catalogVersion": "2026.08.05.1",
  "packages": [
    {
      "id": "llama.cpp-b10107-windows-x64-cuda12",
      "version": "b10107",
      "distribution": "official",
      "sourceRepository": "https://github.com/ggml-org/llama.cpp",
      "sourceCommit": "c0bc8591e8815c63cb01dd3f051a8b0df02501c9",
      "platform": "windows-x64",
      "acceleration": "cuda",
      "priority": 320,
      "buildFlags": ["GGML_CUDA=ON", "LLAMA_BUILD_EXAMPLES=ON"],
      "cudaArchitectures": ["75", "80", "86", "89"],
      "compatibility": {
        "minimumWindowsBuild": 19045,
        "cpuFeatures": ["avx2"],
        "minimumComputeCapability": "7.5",
        "maximumComputeCapability": "8.9",
        "minimumDriver": "551.61",
        "runtimeRange": "CUDA 12.x runtime bundle"
      },
      "artifacts": [
        {
          "repository": "ggml-org/llama.cpp",
          "tag": "b10107",
          "asset": "llama-b10107-bin-win-cuda-12.4-x64.zip"
        },
        {
          "repository": "ggml-org/llama.cpp",
          "tag": "b10107",
          "asset": "cudart-llama-bin-win-cuda-12.4-x64.zip",
          "expectedSha256": "8c79a9b226de4b3cacfd1f83d24f962d0773be79f1e7b75c6af4ded7e32ae1d6"
        }
      ],
      "licenses": ["MIT"]
    },
    {
      "id": "llama.cpp-b10107-windows-x64-cuda13",
      "version": "b10107",
      "distribution": "official",
      "sourceRepository": "https://github.com/ggml-org/llama.cpp",
      "sourceCommit": "c0bc8591e8815c63cb01dd3f051a8b0df02501c9",
      "platform": "windows-x64",
      "acceleration": "cuda",
      "priority": 310,
      "buildFlags": ["GGML_CUDA=ON", "LLAMA_BUILD_EXAMPLES=ON"],
      "cudaArchitectures": ["90", "100", "120"],
      "compatibility": {
        "minimumWindowsBuild": 19045,
        "cpuFeatures": ["avx2"],
        "minimumComputeCapability": "9.0",
        "minimumDriver": "580.65",
        "runtimeRange": "CUDA 13.x runtime bundle"
      },
      "artifacts": [
        {
          "repository": "ggml-org/llama.cpp",
          "tag": "b10107",
          "asset": "llama-b10107-bin-win-cuda-13.3-x64.zip"
        },
        {
          "repository": "ggml-org/llama.cpp",
          "tag": "b10107",
          "asset": "cudart-llama-bin-win-cuda-13.3-x64.zip",
          "expectedSha256": "1462a050eb4c684921ba51dcc4cc488a036674c3e73e9945ee705b854808d03e"
        }
      ],
      "licenses": ["MIT"]
    },
    {
      "id": "llama.cpp-b10107-windows-x64-cpu-avx2",
      "version": "b10107",
      "distribution": "official",
      "sourceRepository": "https://github.com/ggml-org/llama.cpp",
      "sourceCommit": "c0bc8591e8815c63cb01dd3f051a8b0df02501c9",
      "platform": "windows-x64",
      "acceleration": "cpu",
      "priority": 200,
      "buildFlags": ["GGML_CUDA=OFF", "LLAMA_BUILD_EXAMPLES=ON"],
      "cudaArchitectures": [],
      "compatibility": {
        "minimumWindowsBuild": 19045,
        "cpuFeatures": ["avx2"],
        "runtimeRange": "Windows x64 AVX2"
      },
      "artifacts": [
        {
          "repository": "ggml-org/llama.cpp",
          "tag": "b10107",
          "asset": "llama-b10107-bin-win-cpu-x64.zip"
        }
      ],
      "licenses": ["MIT"]
    }
  ]
}
